{
  "$schema": "./PROVENANCE.schema.json",
  "schema_version": 1,
  "audit_date": "2026-10-27",
  "policy": "assets/README.md",
  "entries": [
    {
      "filename": "apps/importer/src/data/region_map.json",
      "asset_type": "data",
      "distribution": "bundled_source",
      "source_kind": "open_source",
      "source_url": "https://github.com/klightspeed/EliteDangerousRegionMap/blob/6c1191a58e1e593966f44f16235ab39d1ad24d84/RegionMapData.json",
      "license": "MIT; Frontier fan-media permission (noncommercial project use only)",
      "creator": "Ben Peddell; Frontier Developments plc for Elite Dangerous region names and game-derived geometry",
      "frontier_derived": true,
      "attribution_text": "Copyright (c) 2020 Ben Peddell. Elite Dangerous material is used by ED-Finder with the permission of Frontier Developments plc for non-commercial purposes; ED-Finder is unofficial and not endorsed by Frontier.",
      "approval_date": "2026-07-22",
      "verification_method": "Byte- and structure-level comparison recorded in artifacts/map-foundation/stage-26e/region-source-review.json; the RLE arrays match upstream commit 6c1191a and the MIT notice was verified.",
      "sha256": "910142d4deb510d80128509bf68cf3b8de8a2c45006d99d4233ee33d95321152",
      "rights_status": "noncommercial_only",
      "commercial_use_approved": false,
      "notice_reference": "apps/importer/src/data/region_map.json",
      "notes": "Local metadata wraps the upstream grid; region zero changes from null to an empty string. Commercial or promotional use requires separate Frontier permission."
    },
    {
      "filename": "apps/importer/src/exploration_value.py",
      "asset_type": "third_party_code_adaptation",
      "distribution": "bundled_source",
      "source_kind": "community_creator",
      "source_url": "https://forums.frontier.co.uk/threads/exploration-value-formulae.232000/",
      "license": "Original ED-Finder implementation of community-researched mathematical formula and factual game constants; no third-party code copied and no source-code license asserted",
      "creator": "ED-Finder contributors (implementation); Frontier Forums exploration-research contributors (formula and constants); Frontier Developments plc (underlying Elite Dangerous mechanics)",
      "frontier_derived": true,
      "attribution_text": "Exploration-value formula and constants are based on Elite Dangerous community research published in the Frontier Forums thread 'Exploration value formulae'. Implementation by ED-Finder contributors.",
      "approval_date": "2026-08-12",
      "verification_method": "Module source, cited Frontier Forums URL, and repository history inspected. The repository contains an original Python implementation of a mathematical formula and factual constants, not copied third-party source code.",
      "sha256": "60d00132b940e756632f30bbb2f39e6eaf80a5be645ba0d5541eae797418dca2",
      "rights_status": "noncommercial_only",
      "commercial_use_approved": false,
      "notice_reference": "apps/importer/src/exploration_value.py",
      "notes": "Conservatively retained under the project's Frontier noncommercial posture because the estimates reproduce Elite Dangerous mechanics. Revalidate mechanics and commercial posture before commercial use."
    },
    {
      "filename": "apps/importer/src/region_map.py",
      "asset_type": "third_party_code_adaptation",
      "distribution": "bundled_source",
      "source_kind": "open_source",
      "source_url": "https://github.com/klightspeed/EliteDangerousRegionMap/tree/6c1191a58e1e593966f44f16235ab39d1ad24d84",
      "license": "MIT; Frontier fan-media permission applies when used with Elite Dangerous region data",
      "creator": "Ben Peddell (upstream algorithm); ED-Finder contributors (Python adaptation)",
      "frontier_derived": true,
      "attribution_text": "Region lookup algorithm derived from klightspeed/EliteDangerousRegionMap, Copyright (c) 2020 Ben Peddell, under the MIT License.",
      "approval_date": "2026-07-22",
      "verification_method": "Source comment, repository history, upstream repository, retained MIT license, and region-source review inspected.",
      "sha256": "fa8e37839e71f3acb7ddea3bda9903b604fff21b56d61abfd20caf0a7b64ba5a",
      "rights_status": "noncommercial_only",
      "commercial_use_approved": false,
      "notice_reference": "apps/importer/src/region_map.py",
      "notes": "The adaptation is MIT-compatible, but its normal use depends on Frontier-derived region data whose project approval is noncommercial only."
    },
    {
      "filename": "docs/reference/colonisation/cre-rulebook/rulebook.json",
      "asset_type": "data",
      "distribution": "bundled_source",
      "source_kind": "original",
      "source_url": null,
      "license": "Repository owner's own work (Colonisation Research Engine); it quotes short passages from the Elite Dangerous Colonization Mega Guide (CC BY-SA 4.0, https://creativecommons.org/licenses/by-sa/4.0/) and from Frontier Developments' update notes",
      "creator": "ED-Finder repository owner (Colonisation Research Engine); quoted passages by CMDR Mechan and contributing CMDRs (Mega Guide) and Frontier Developments plc (update notes)",
      "frontier_derived": true,
      "attribution_text": "CRE rulebook (cre-knowledge-v0.3.0), quoting the Elite Dangerous Colonization Mega Guide v2.3.0 by CMDR Mechan and contributing CMDRs (CC BY-SA 4.0) and Frontier Developments' update notes. Not endorsed by Frontier Developments.",
      "approval_date": "2026-10-27",
      "verification_method": "Byte-for-byte copy of exports/rulebook.json at tag cre-knowledge-v0.3.0 of the owner's elite-dangerous-research-engine repository; SHA-256 matches that tag's exports/export_manifest.json and pin.json; the CRE validator checked every quote against the committed Mega Guide text (PDF pages) and the Frontier source notes before export.",
      "sha256": "0487fcfb8149fcb28076145120ee04d1ccb83171df70868a4f48edf95cc21bd4",
      "rights_status": "noncommercial_only",
      "commercial_use_approved": false,
      "notice_reference": "docs/reference/colonisation/cre-rulebook/rulebook.json",
      "notes": "Reference data for the parity test (tests/test_cre_rulebook_parity.py); not read by any build or runtime. Held as noncommercial_only because it describes Elite Dangerous mechanics and quotes the Mega Guide, whose Frontier permission covers non-commercial purposes; the CC BY-SA 4.0 share-alike terms apply to the quoted passages."
    },
    {
      "filename": "docs/reference/colonisation/sources/mega-guide-v2.3.0/mega-guide-v2.3.0.txt",
      "asset_type": "data",
      "distribution": "bundled_source",
      "source_kind": "community_creator",
      "source_url": "https://forums.frontier.co.uk/threads/colonization-mega-guide-v1-0b-released.638126/",
      "license": "CC BY-SA 4.0 (https://creativecommons.org/licenses/by-sa/4.0/), as stated in the guide; the guide also states it was made with Frontier Developments plc's permission for non-commercial purposes",
      "creator": "CMDR Mechan, with input/additions/comments/suggestions/corrections from dozens of CMDRs (guide author and contributors); Frontier Developments plc (underlying Elite Dangerous game and mechanics)",
      "frontier_derived": true,
      "attribution_text": "Elite Dangerous Colonization Mega Guide, version 2.3.0 (2.4.0 WIP), written by CMDR Mechan with input from dozens of CMDRs, licensed under CC BY-SA 4.0. Unmodified pdftotext extraction; images omitted. Not endorsed by Frontier Developments.",
      "approval_date": "2026-10-21",
      "verification_method": "Owner-supplied 121-page PDF (SHA-256 aaabd23cf5ed6161a9b2dadb76a6a7d6b385e4d8c73e87de3bca0339087b69d5) inspected; its title page carries the CC BY-SA 4.0 grant and Frontier non-endorsement notice quoted in the folder README; text produced by pdftotext -layout (poppler 24.02.0) with no edits; Frontier Forums release thread located for the source URL.",
      "sha256": "359e8fd00d3df3da0f10562f19012c7f71d06cf82933d09bfcf89d1fb296fbd3",
      "rights_status": "noncommercial_only",
      "commercial_use_approved": false,
      "notice_reference": "docs/reference/colonisation/sources/mega-guide-v2.3.0/mega-guide-v2.3.0.txt",
      "notes": "Reference text for citation and review only; not read by any build or runtime. The PDF and its Frontier imagery are not committed. Held conservatively as noncommercial_only because the guide's Frontier permission covers non-commercial purposes and the text reproduces Elite Dangerous mechanics; the CC BY-SA 4.0 share-alike terms apply to any redistribution or adaptation."
    },
    {
      "filename": "frontend/public/assets/elite-dangerous-region-map.LICENSE.txt",
      "asset_type": "license_text",
      "distribution": "bundled_public",
      "source_kind": "open_source",
      "source_url": "https://github.com/klightspeed/EliteDangerousRegionMap/blob/6c1191a58e1e593966f44f16235ab39d1ad24d84/LICENSE",
      "license": "MIT",
      "creator": "Ben Peddell",
      "frontier_derived": false,
      "attribution_text": "Copyright (c) 2020 Ben Peddell. MIT License.",
      "approval_date": "2026-07-22",
      "verification_method": "Local notice text compared with the license at pinned upstream commit 6c1191a.",
      "sha256": "f53e7fcde70b59ecfda402dac7bc35700c56f1472eec46bd26acc9bad06676b6",
      "rights_status": "approved",
      "commercial_use_approved": true,
      "notice_reference": "frontend/public/assets/elite-dangerous-region-map.LICENSE.txt"
    },
    {
      "filename": "frontend/public/assets/elite-dangerous-region-map.svg",
      "asset_type": "image",
      "distribution": "bundled_public",
      "source_kind": "open_source",
      "source_url": "https://github.com/klightspeed/EliteDangerousRegionMap/blob/6c1191a58e1e593966f44f16235ab39d1ad24d84/RegionMapData.json",